Source,Title,Link,Date,Summary
Google News,"The road to better completions: Building a faster, smarter GitHub Copilot with a new custom model - The GitHub Blog",https://news.google.com/rss/articles/CBMi2AFBVV95cUxOSUd0NGhMTEI0YWFnUEFrZEZHdkFqdXhob0Y5cmJLRmhybTEzNWh5el9rOGRmTlg3QnVrQmpna0Y2SzJMOUNBZWZWVVFBV2E2YnVUVTZmZWpzVTkxNVJVZEVsU3lPRnNZM2dHVDQweTEyTlExTkRrOVNsTzkzakk2UTNSOFpGUlQxNjBXM0x0SUJrRTdUNXFwVkM0am1iTXA5dEFRaGU0RGx3bXZ2a2t5UkRNUmFjMFZUbGNRTFo2aXRzNHZxQ3dXRnluVGw1dlBnS2NkVlVILW0?oc=5,"November 23, 2025","The road to better completions: Building a faster, smarter GitHub Copilot with a new custom model  The GitHub Blog..."
Google News,How GitHub Copilot and AI agents are saving legacy systems - The GitHub Blog,https://news.google.com/rss/articles/CBMipwFBVV95cUxOWUVSYVNPT3Z0YWVfMS1YMWRIQW83TVVtRk5CUjMwSm1aLW1zR0NvMzdMc25Ea2QwTEw2UmZoTl9CdW1fSFNwRklNT19rdzltZEdPUGxxYUczSFA5cmh6anJ2Z2c4dmM4V0stM2UyelkyYmRTdDdOSHREbENMMVFxNFVwbmh6Y2V3MTVRZE1kRlZKcEg4N2hvd3pfRTZyZ3hmZjJDV2tuYw?oc=5,"November 23, 2025",How GitHub Copilot and AI agents are saving legacy systems  The GitHub Blog...
Google News,Anthropic Claude Opus 4.1 is now in public preview in GitHub Copilot - The GitHub Blog,https://news.google.com/rss/articles/CBMirwFBVV95cUxPS1EyZVpEemo0NDhpUl9lSm9LRE9odXhjbWU3N3dTRHRZYTVoYmU3ZzZzdHl0TWJXUFdHLUtUaE55dFFNZ1I4U0RVeEo2UFpuX1RaZmNTR3p4aWtqbmkzYWFUUVktbjYyM1lnZFR1Ylo2cnFCREpVV1dDQVNTR2pSblRteVR4V2cxc2czNzJ2M3hhM2ZCbEp4cjBDWGlMUk5JMG1KWTZPZWVydFVtN0N3?oc=5,"November 23, 2025",Anthropic Claude Opus 4.1 is now in public preview in GitHub Copilot  The GitHub Blog...
Google News,Gartner positions GitHub as a Leader in the 2025 Magic Quadrant for AI Code Assistants for the second year in a row - The GitHub Blog,https://news.google.com/rss/articles/CBMi8wFBVV95cUxNTXE1a0V2b2NtY3dLYjNZVDZJb2VHdHRFZGxqcWNJR0lJTEl0Z2RpTDQtM3NwV2F4amRiWURmYmNZWmlWQTBNQnNBQlhpZV92Tm1ZQ05SYXMxNTEyUDl4eGRsbnZ0eFI4RDJqVGw1RHNGTUU2VjdOTXAzMG9jQ2ppMXdHRzJLc05iZ2xuMmFoLTlRa09WeUNfeG1IbjlhcUJaM1doY0Rmb08yeU9EaUloR090bkV5M0M2NWFFblExOGI3TXZoeC02aUdWOTBYbTlFN2JuSUtqc3k1WkpyOFJHaFRKSE5ZNmp2TlFVbi1EQWlmT2s?oc=5,"November 23, 2025",Gartner positions GitHub as a Leader in the 2025 Magic Quadrant for AI Code Assistants for the second year in a row  The GitHub Blog...
Google News,Grok Code Fast 1 is rolling out in public preview for GitHub Copilot - The GitHub Blog,https://news.google.com/rss/articles/CBMirwFBVV95cUxQMjR4TVpfTlc5YXZXeXZfM3JJa0hoMXZ3NXhmTXpYSWZ0WDcxZFRoUTRQRERyVVFHOWhUV1JmdkhPR0I2NklKSE5qZGZ2dTRKazNzRGx0QUhXeFN1Njk3b21rbkh0LXhsQmkyb3hGN1gwYkRaSFdiemVzTmJwQWNHaFpkSzNsaHFXSksxY2NCRDZMc2ZIUFBENnU3bjRhajhTU1BqRDBDTENQNS1uZkFN?oc=5,"November 23, 2025",Grok Code Fast 1 is rolling out in public preview for GitHub Copilot  The GitHub Blog...
Google News,GitHub Copilot gets smarter at finding your code: Inside our new embedding model - The GitHub Blog,https://news.google.com/rss/articles/CBMiiwFBVV95cUxNeDdnOVc1X21FdnA0LXNVUkV6anlkUkNOaEJqXzB0OElRZU9yLUI1aDBLck8wOE9TY1lOMWh1NGRuU0FuZGFmZkJSejlsQUo1UHNZQjJmWmZDdDU4dGtTWVpUX2ZLMm1FbzNGLVVyU1pTZEZfdm01eFFCTDlmbm4yQkRwR0UycVNxMkRJ?oc=5,"November 23, 2025",GitHub Copilot gets smarter at finding your code: Inside our new embedding model  The GitHub Blog...
Google News,Agents panel: Launch Copilot coding agent tasks anywhere on GitHub - The GitHub Blog,https://news.google.com/rss/articles/CBMiswFBVV95cUxNNUo2RjNLaU1XaE9UT3c3eW5XZlR2bE9nOUthSDdtOGdiTjhfdGJlOFRuamVuLXZxUjN5dmVsckNJUmxjS1RKWDFVWnZYc1Y5Y2RJZ0NCRzZnOGVWXzI5eUNPdTZMMkJTWXR1azZhTXlLWm0wS2Y0a1RSNkktd2dSam5hYWtETElSTHhHa2R6bE5PSW5YUHFQNTg3am56S295VGRTZUszUWgzazZ0dTgtV09yNA?oc=5,"November 23, 2025",Agents panel: Launch Copilot coding agent tasks anywhere on GitHub  The GitHub Blog...
Google News,GitHub is enabling broader access for developers in Syria following new government trade rules - The GitHub Blog,https://news.google.com/rss/articles/CBMiwAFBVV95cUxPMDNQNmVQMVdlSzJHTTF2M1p3ZjFhV0xROU5rVHdFdEdHQUVFTzVNYWg3a2ZUb0Qta0c5cjJOeTVNdDNRZ1h5MEZDcHBLUUFGQTBvQnN1QmY0NVBONnZQN2Z4X3RqUG50RXZxMkMtRk1sMk9waXNKYVpWZGw4UWlIcEt3ZmQtOE5TWll0MXlyb0EtQV94ejliWE5vcFZMZ3UxdVVfY0M5MFM4OC02Z3R0VHNIUmxYRGFaU2tKa08zcF8?oc=5,"November 23, 2025",GitHub is enabling broader access for developers in Syria following new government trade rules  The GitHub Blog...
Google News,OpenAI GPT-4.1 now available in public preview for GitHub Copilot and GitHub Models - The GitHub Blog,https://news.google.com/rss/articles/CBMiwwFBVV95cUxOVU1xNkhuaEwxczU0Um5jdmpEbDNRS2c5czY4SmVZUHg1eEJnRkNPMHJXSTNkN3d4NVNqc3JRRFo5YmdYZ1hoc0VSQUg3MXpuU0YzZ3NOQmdKTFVaaTM1eVF0alA5UEs5MTJfRWdSMlI1STE1Wm1fdTRFaE1la09ELV9va2tFc0FsaS03VVlxTHlpcTJoS2NCYm9rbEdNb3ZsWWdRSExXTDJJRzlzSWlJcjI4dmthZ3RtVUNaMGFLMlJoMTQ?oc=5,"November 23, 2025",OpenAI GPT-4.1 now available in public preview for GitHub Copilot and GitHub Models  The GitHub Blog...
Google News,Anthropic’s Claude Haiku 4.5 is in public preview for GitHub Copilot - The GitHub Blog,https://news.google.com/rss/articles/CBMirgFBVV95cUxOSy1PZHRZaUwwTk1wSml1TDNCUnN6STlpeldrS2R4anlUZk9PT2hmY0RWc0tzSDVNWVo1T21jRzlYZXdsX2lnVUpOMFRxMjZZOVRTa2M2THNoQldHMDRVamZPN2RWenEtbGFDMFJnVzNSbklZdkNLei1tVVhoVnpyTF8yeFlpUGFYQUdpZUNWVVcybnBEd214a3I1cG9CZjBTRkpIbW8tMFFGNklMcHc?oc=5,"November 23, 2025",Anthropic’s Claude Haiku 4.5 is in public preview for GitHub Copilot  The GitHub Blog...
Google News,"Introducing an Interactive Code Review Experience with Amazon Q Developer in GitHub | Amazon Web Services - Amazon Web Services (AWS)",https://news.google.com/rss/articles/CBMivAFBVV95cUxNWVhuaENNS3E1NFBUMDVVUXRSQTVlZG5HbG9ib0FfV1ZLZlNxQW9ReHd2bWpqZmx2X2IxUE1XZVRHVWZEVUszZGJVNGlTSUhCMzA4V2lnWEZuR0tGcDRhOExScTlBRndDNGVGRjFnM054TW5CcWJkbkMzSkJfczZjUHBoT2JYbnlpQWgtMTY2bkR1bWlWWmM3ZVc2U1NuN3JoT3N3MUlaNHJfVVpMZUNLS213MWplbDBTbGl3NQ?oc=5,"November 23, 2025","Introducing an Interactive Code Review Experience with Amazon Q Developer in GitHub | Amazon Web Services  Amazon Web Services (AWS)..."
Google News,GitHub Copilot CLI is now in public preview - The GitHub Blog,https://news.google.com/rss/articles/CBMijgFBVV95cUxNdWU5dzh2amdCOEFoWGdzaENvSlFFamtLYjdkM1oxZFQ4SEY5cVhqNHVHX2RFb3NwZXhQTFF5WEQ2SXo5bUd1a1NvajNZek1RakJjOVA1SmtEVDBVVV9HQU9MbHVydTNFbER2dkZWZEJDRXdheTc0bzNGQ05ieGFqMkdDN3Z5cm5LbnlrMGp3?oc=5,"November 23, 2025",GitHub Copilot CLI is now in public preview  The GitHub Blog...
Google News,Start your new repository with Copilot coding agent - The GitHub Blog,https://news.google.com/rss/articles/CBMimAFBVV95cUxNMENackxienBxYldMQjFPanp2WVhUMkhJLXMyTkdQTDFPS2ZCTG1Tekx3blJIdXgxU0kwMWtnLURsZXFPWE5lV2d6N182amxBUXVUS3dVZng1bHJLQ000Yzhrck9iMVlJVHRJS0NZQ21tZnNjS0RHVGt5bHl3SXJOQktfYnZsbkZVdnRYNjBSa1BjQzAtM1h3Vg?oc=5,"November 23, 2025",Start your new repository with Copilot coding agent  The GitHub Blog...
Google News,GitHub Copilot CLI: How to get started - The GitHub Blog,https://news.google.com/rss/articles/CBMiiwFBVV95cUxPTDFXWURYSWV5NHEya1AxeXplSGpnWU1kRjRfTXhmMnVlcGl2MW9EeEdNWC1QTjlxOHpCSDk5T0phZHY3YkQ0TmhhUzFTalczMzhyRHk4TnExbE9GX0lDNzN6SDM4Y3VCb01EWGhTMjRObkVnRkd4dFpyb1phTGwxNjBXSDdDNWFFNnJv?oc=5,"November 23, 2025",GitHub Copilot CLI: How to get started  The GitHub Blog...
Google News,"Copilot .Net modernization tool a ‘huge downgrade,’ devs say – and no longer free - devclass",https://news.google.com/rss/articles/CBMirAFBVV95cUxQMlN1VUN2LUNFN2ZXQk5YVUJnSDV5OHQzenBrVXBMS0VHQnRLQk5lX080ZnpsamVISzBIOHhSODRMbGg3R3R2UmMyNkRtMTV5R1Vyc19vYlI4ekpHSEplcmxvVEdGQk1DQldaY1NEbjVQYVBobFVLamlpbDBsSjZzOGRWVkpSTUFRX2VLVlY4WkowWkNQQ19CU1FBMG1vTFhXWE1DbnAteVNJR3N3?oc=5,"November 23, 2025","Copilot .Net modernization tool a ‘huge downgrade,’ devs say – and no longer free  devclass..."
Google News,Vibe coding with GitHub Copilot: Agent mode and MCP support rolling out to all VS Code users - The GitHub Blog,https://news.google.com/rss/articles/CBMiiwFBVV95cUxNcU5uLVFaZFhKQ0hxeEtvV0YybUFJLUo3dkxobkNhMDBEcE50cHBBckFuZTZ2Q1J6ZzZpNjdoQWxxdms1NzNEeHV4RU5xNW1GVHJCOGpaYkN0UW5VVnB1cEktVU40ZkpYZ0JpdlU0VFFJM016Y0hlWXlhckw4cnB3NVhYNnJrbGZvZjk4?oc=5,"November 23, 2025",Vibe coding with GitHub Copilot: Agent mode and MCP support rolling out to all VS Code users  The GitHub Blog...
Google News,Meet the GitHub MCP Registry: The fastest way to discover MCP Servers - The GitHub Blog,https://news.google.com/rss/articles/CBMitAFBVV95cUxQejlMNTF6bHNlLS1rc1dwRnctV0VHQmlIaGFMQUF0eTB6dXZnSllicVhXZGtkOEVrVk5ucHBnbF8tTXNMajNiaEhtaGZla0pCUTBlRE9YaGJKR2NadjF6LVRpQkpHOTh4dU1FQjJCam1odTRFdDZJRWNmc3BOcGhRTldCVjViSGZtOHlJQUloQmJFbWhBQm1mRlhfU3VWZFU0WkI0VFBCZTU4RENqLUMxT05nVVI?oc=5,"November 23, 2025",Meet the GitHub MCP Registry: The fastest way to discover MCP Servers  The GitHub Blog...
Google News,How to git push an existing project to GitHub - The Server Side,https://news.google.com/rss/articles/CBMiuwFBVV95cUxQX25MTmlaQmRKdkRyX05iQ2k3a01oS2RHNUlTNUdRU0dCYWxEZmN4MVhLa3ZhakU3TXl5QzdXVmZQV0l0LVlTdS1FTUZiSkY2ckZGSFphT2k4SkZ0M3g2aTBGMUNHQXcxcnBVaFBNNkZpeTBzNVF6RkJfbzVUVEtTNEtndDg3UWFQYzBXRTlUem9rZ2taa0o4cElOVVl0YWFvdl9RYkdrREdlOVRRUHFrUDExQzI4SGN3R0Zz?oc=5,"November 23, 2025",How to git push an existing project to GitHub  The Server Side...
Google News,Microsoft says these new AI tools will help coders avoid tedious tasks and burnout - Fast Company,https://news.google.com/rss/articles/CBMilwFBVV95cUxORy1wT3lPLTVTVnJTa210WmVEaVNTcVV4T1JpMDhsMV9VNHRMUXlkXzNZS2VubmlBYjhaa2c5RmNfLTlMeWlpT3BBZVMzRTdTN3hqcWR5Q3JsVlU1NXJBTHVvaElvYUxueHpCQUJ6RFRZUWpMM1ZkbWVfdHN3U2htY0hYdjdISVpocWJ3SXFpcFdGcGt2d2ZZ?oc=5,"November 23, 2025",Microsoft says these new AI tools will help coders avoid tedious tasks and burnout  Fast Company...
Google News,GPT-5 is now generally available in GitHub Models - The GitHub Blog,https://news.google.com/rss/articles/CBMilgFBVV95cUxNcmlBVzlhbG5KZDVJUHVnekM4eVFBUW5hUEVDcnp1Znh5b2tUb3VKcGw2dmtEVWY1aUs4cF9yMUt1RnJKbzZQUVNTaDNBXzh2eHZWVWRyMmZQTmlKTHcweDFqY2ZPTnU0ZGFRVFo4aEoxVlFMTXlVSGh0eU1rOENod1hGVDVJWm9uR1ZjS1N3YVZTb0ZmVUE?oc=5,"November 23, 2025",GPT-5 is now generally available in GitHub Models  The GitHub Blog...
Google News,GitHub Copilot on autopilot as community complaints persist - theregister.com,https://news.google.com/rss/articles/CBMic0FVX3lxTE1jNjRTZjFwWXNDMjhaMFJuUjYwVWlxVXlfUlBKUklxbzR1MXB6aUFEQzkwUlBEUklIVlE3S1l4WG4yMUN6TzA2N3g5TmI2T3BnSW5YejVlZHBTbEx3MXpIclZpTVdQVUdCNmlRLW91OG1iVnc?oc=5,"November 23, 2025",GitHub Copilot on autopilot as community complaints persist  theregister.com...
Google News,GitHub will join Microsoft’s CoreAI division with departure of CEO Thomas Dohmke - GeekWire,https://news.google.com/rss/articles/CBMiqwFBVV95cUxQOHR6WEJmN3pwdVNNSmFDMTFzSjB2NjJMZmx2a0ZRSG1xUUpBbU9UbGRMbE9lRDFrNUk2bnNKd25IZHpsN0JVM0FJVUNJbXNtSF9BcEhkamdTYTFwUkJLQkwycXVWYkk2UE5mb1lZN3ZCV0kyRks1NFVmWHc3aW94eGtqU1FsQ3l4RnNNeFJRZFVfODMzQ2xaYjczeFJFNE1QckFrV0xQWWpZWDg?oc=5,"November 23, 2025",GitHub will join Microsoft’s CoreAI division with departure of CEO Thomas Dohmke  GeekWire...
Google News,Start and track GitHub Copilot coding agent sessions from Visual Studio Code - The GitHub Blog,https://news.google.com/rss/articles/CBMiugFBVV95cUxNcGdSR0otVVd0N0dPdThkLUlEUmRyVVctOXI0RGh1NFpuMzZKUm5jWnN5THlmcWNRZTBiRTl2VFI0QWhfU1FQaHk0RmhEMld3enpxX194VmZtUGgtWk9LeERLX0RfakVCQUhPS29jbTVvQWllcjdfZDV6eGxqeFc3eERKZ08xcEh2eWFvdWpvMExiOXQ4NDdWQ25NeHBTd2hvY0JobkdVcHoxbGpXRjhEQlE2VUtZR3dPdmc?oc=5,"November 23, 2025",Start and track GitHub Copilot coding agent sessions from Visual Studio Code  The GitHub Blog...
Google News,s1ngularity: supply chain attack leaks secrets on GitHub: everything you need to know - wiz.io,https://news.google.com/rss/articles/CBMiZkFVX3lxTE5XaTlhd2d1LThjNmN3SmhUbDlRSkpZWTVSRVNqelVIb281TS1vN3plY0dQSVg4MDdkZ1ZDUGdtcVhWRXA5UlZwd1VhVEhOVkNCOVZ1MjA1dUo0Y1VkZkFMZlNMWVV2UQ?oc=5,"November 23, 2025",s1ngularity: supply chain attack leaks secrets on GitHub: everything you need to know  wiz.io...
Google News,GitHub Mandates 2FA and Short-Lived Tokens to Strengthen npm Supply Chain Security - The Hacker News,https://news.google.com/rss/articles/CBMif0FVX3lxTFBTSTJnak1LWkRSOGYtR0w1c1ZvaTVIYnBmUTZkaW51NzN2TGtmWUV3a05ka0RLZUtsVGlVZTFPSVRHSEFMbnE3b3h6bkRlR3VMalhQMXNsYWt2SHlSZVVuY3NqZm1HYmUyVm1DSHZSQXhFenMzNDU5eWgwUUtLT0U?oc=5,"November 23, 2025",GitHub Mandates 2FA and Short-Lived Tokens to Strengthen npm Supply Chain Security  The Hacker News...
Google News,GitHub Copilot coding agent 101: Getting started with agentic workflows on GitHub - The GitHub Blog,https://news.google.com/rss/articles/CBMixAFBVV95cUxNdVYzdklKdDJVVnJkQUp1dlhQUkFKd1lHbGN3QTlEVUtudTlsNHlwSGloOGwxZTl0V19zdWJNNkF4UkplT2JwNk1ZYmo3a2JGcUFwbmZtY1lEUi1ZQi1BcWxwd3NIWjAyRWkyZ3I1dTNlNnFrZzZNbmEtOTdWanliTTZHN25wUGY3RVg2TE41Njl6YzBjQWNMTXEySFRCOGZ3OGFlel9aeG1HWjVrUjNmMWg3Sk9vRUQ0RXAxU0RnODBsMEdM?oc=5,"November 23, 2025",GitHub Copilot coding agent 101: Getting started with agentic workflows on GitHub  The GitHub Blog...
Google News,Under the hood: Exploring the AI models powering GitHub Copilot - The GitHub Blog,https://news.google.com/rss/articles/CBMirAFBVV95cUxOMllJalZVUkdHX01RWmlpbHRoaWw3bjg3UlJ1bTh1VDhyRlN0ZFVJSml2akpnM1dGbTl2Zk13d3BPaXFYVUdwQUhQa1hnTGlJRFRINTRxamxPWFpXMlZzakNnb1JJVGM2ak55RlNfbzdRekpubG5xNHBPaDJObzNoZHNZc1ZfWmVaa18wSzBmbXJoZUphYnk1eHNwelNFc2I0cGZ4bE9EWmZtSV9R?oc=5,"November 23, 2025",Under the hood: Exploring the AI models powering GitHub Copilot  The GitHub Blog...
Google News,Accenture ignites innovation for thousands of developers using GitHub Copilot and Microsoft Learn - Microsoft,https://news.google.com/rss/articles/CBMigAFBVV95cUxNcW8zX01KSVNFYlpVWVFSRlNMNVZkbUZFZWx2VGdYRFl2aUdCYklqTWdQVGVKbmc0LWlXTmVqS1ZhbW8tQU9nU3NBc2o5QzN4LVA0VDdWVm9nYXRxTWp6czdGZXN5TXg0SFdmR3liQzc0VGRUbnl2VzY0dVB5aF9XMg?oc=5,"November 23, 2025",Accenture ignites innovation for thousands of developers using GitHub Copilot and Microsoft Learn  Microsoft...
Google News,We need a European Sovereign Tech Fund - The GitHub Blog,https://news.google.com/rss/articles/CBMiiwFBVV95cUxNc2J6eXlvQXN4TXNianl6NWZmTXh6dnYyRU04OW9jc3AtbWtKeVRVN0ktcUFuSHBVQnBveWtid0VpaUdydGJQWnI5dTdoZGVXdU9JbXdXOVFDNHVEbHVaZGw3NXhkS0J6ZXBYVEdBWUR1NDI1NjdFb1dRM21KMjF3R2VYM0h1UGdzMVBr?oc=5,"November 23, 2025",We need a European Sovereign Tech Fund  The GitHub Blog...
Google News,"HiddenGh0st, Winos and kkRAT Exploit SEO, GitHub Pages in Chinese Malware Attacks - The Hacker News",https://news.google.com/rss/articles/CBMihAFBVV95cUxQN3IweGtFSlFTZFVyWDRIYmpXVzJmWGotRmp5MlRFSUg4YXhmN3RjY0ZrSE92aUUwSUdvUXNvNWJTR0FHbEpubVlfSmdJczZYd0d2dWV3SE9FVUxqVnRfM1BDOUtQekRWZkc1Q0RLbGczY2pKY0FkQjQxbG5JNldfZlNhSEo?oc=5,"November 23, 2025","HiddenGh0st, Winos and kkRAT Exploit SEO, GitHub Pages in Chinese Malware Attacks  The Hacker News..."
Google News,How to use GitHub Copilot on github.com: A power user’s guide - The GitHub Blog,https://news.google.com/rss/articles/CBMiqAFBVV95cUxOZTdqbWgyaWo4eVJqdldlN2FLQ2xTWmFiZURValpYeEhpZ2hJOWI2QmxLRkkzVFFKbDk5YUo0aFhGc2ZmZEZQQ05hS0hVbmVPM3llXzNIMjd0aV9vVEFGS1hnelJxYnlvd2lXa3NsbzlZNGlnWkxYNXhIU2p0bnhUS1pKeVhFbHp3V0lBWmtFWjI1M2ZNY1JBWVdYVnRuLTE2dWIwMWtSR18?oc=5,"November 23, 2025",How to use GitHub Copilot on github.com: A power user’s guide  The GitHub Blog...
Google News,Deprecation of Node 20 on GitHub Actions runners - The GitHub Blog,https://news.google.com/rss/articles/CBMilAFBVV95cUxNUHB4bmRkLVhuRVBuYTNmNnVMc0VISWJTZnlpazROZjNTUzgxb090NndfSzdvTXRXcTVRUlJ3bUZpdFM3eXIyZVp5Q280ZFNSZ3dRWkpycGlkbW55MkpaQWphcXBiU19SNFRBTEdRVzJTUHZ6Rm01VEFwY0drVE0xOHpUSXltczhXRWNhMlk0bzhUTWFk?oc=5,"November 23, 2025",Deprecation of Node 20 on GitHub Actions runners  The GitHub Blog...
Google News,From karaoke terminals to AI résumés: The winners of GitHub’s For the Love of Code challenge - The GitHub Blog,https://news.google.com/rss/articles/CBMiwAFBVV95cUxPU0ZGcTd3LThZSWgxMmRNNGN0OGZCeUpaZTZRTXF3UnQ2b05VNWJZanM5UUM2Y3RRMnNIUC15LUpFMG02UERZT2FCMFh0WEJnbnpfTHA0dWNkMGhnVXNESkM1UnRld3c5aDNQcy1BTGVyLTF5QXIzbnRzMmtnaXNzOWI1cXYyZFkwSkNUUEc3YkMwQ19JM2xDNGhhZF9hTU1LN0l1V2JkenphZzY2Y19jSDdfUU1MX1NERkZpZEpBdmI?oc=5,"November 23, 2025",From karaoke terminals to AI résumés: The winners of GitHub’s For the Love of Code challenge  The GitHub Blog...
Google News,Strengthening npm security: Important changes to authentication and token management - The GitHub Blog,https://news.google.com/rss/articles/CBMiwwFBVV95cUxQZm05OFZjb1NsU1NKS2tHVkNrRmdQMmtjQnF3Z04wVUN5aXpwSHFVMWpvSDVlRjNHYlhrSWtkRGdpdVpZZjJJUF9GX0Z2U2tIMHBHYVZ3ZmxjMUxSUlJZdnViSEdhZXczMXRYZW1zWEU5VEhLNkdnS28taThVZGpCcVNMZHAxX1Z4R01NV2N3UGxBb3drR0poTWNDMWhtOTM3TjZWcTZ4Rm5SbGFfS2s0MU5ySWpwS3A2UG43UlNEYTFpbzQ?oc=5,"November 23, 2025",Strengthening npm security: Important changes to authentication and token management  The GitHub Blog...
Google News,Why GitHub Isn't Just a Tool—It's the Developer's Home Turf - vocal.media,https://news.google.com/rss/articles/CBMilAFBVV95cUxORHdhUTFIdmNXS3JmZWRkTDIyNFY5RjV0S0ZrYmdfMk10eGY4cmMxYWRJX0htZm53T0RJSk85Sk5wYVdnaFVpYklXb0xQTmFabDE0SG1lYXNtSExEZXBsRnhXdUs4dFNsc1ZIQTRsRE5sWHhkX2VVZWdDQmNsRmJKYXpUN3JZWU0yTDRRcFNRQmFIdzlE?oc=5,"November 23, 2025",Why GitHub Isn't Just a Tool—It's the Developer's Home Turf  vocal.media...
Google News,Highlights from Git 2.51 - The GitHub Blog,https://news.google.com/rss/articles/CBMibkFVX3lxTE9wNjkxeHdrckJ3amk3aFdlS05hSDBWSEFrb1hXZ1U2a0sxbzJla2poSUZqN0ViSy1aSkdld3Q3dmhzUE9veC03cTZkbXFoY0tZWHNCdHdZRm9FekhfY3ZReGwwMmVzWklzalIzdlV3?oc=5,"November 23, 2025",Highlights from Git 2.51  The GitHub Blog...
Google News,Anthropic Claude Sonnet 4 and Claude Opus 4 are now in public preview in GitHub Copilot - The GitHub Blog,https://news.google.com/rss/articles/CBMiyAFBVV95cUxONWFQakU4VUhETjZhM1RKazhNZ1lEYU9WRFYteFBvVjhTdVhWSW9JYTFqb1lDa242SUJicmdnLW9rRFkxeUpqMEh2X09Lb20tN2tpb01BSDNBTlY5MnA4emV4dUxLOWpTcWl2QjdRdWF5MFJ0dF9rTnotVXc0SGJTSF9VOTY5UEZvcFVVd180OHVjaUd4dW52QWhNbzd5clkxclBSaFN3MzF6TWs2dGtFRFI4LTZsWGMtcktzbWhyaWxld1F3dS1VaA?oc=5,"November 23, 2025",Anthropic Claude Sonnet 4 and Claude Opus 4 are now in public preview in GitHub Copilot  The GitHub Blog...
Google News,Securing the supply chain at scale: Starting with 71 important open source projects - The GitHub Blog,https://news.google.com/rss/articles/CBMixgFBVV95cUxNdTZjejdLRllIRTBTMnlaSGYwMEU4OEtyOHZXZjJXelVhaVNqQXptTkxoUTlLdUZpcV94alVBR3JFTjB2NXEyTGNrekYwNENYQTR5aFdZbEFJSzZ4bGF2OXg0WWVsUFF5T3FYTTQzWldwbHFaV3JVQ0dCODBMSHdpaU1xX0pmZm9RczltR0hnekVkb2NjXzUxS203dG1PYjFUVHFRTm40WVJnQnR5Wld3c0pMNHhVTjFnZzBYX3dIaHprbTVRalE?oc=5,"November 23, 2025",Securing the supply chain at scale: Starting with 71 important open source projects  The GitHub Blog...
Google News,GitHub Copilot coding agent now uses one premium request per session - The GitHub Blog,https://news.google.com/rss/articles/CBMirwFBVV95cUxNYmtTRmxCa1JadXp0bGZxWV9uRlR4Skx5MTdCcGFYT08tT1dkNHF4bDc1Szl4eVRLcE56Rmh4WjY4TEdVQUMwTk1hbmwtR3VVLUt1Y2pxd3FSTUhpbUJybjlfOGd6bzE4VkEwNm44LWdQY3NodzFLcWJLOGhjbWVBNHdmV0F1dGJObk42YWN3N0tMaWtTWG9ZaGRZVHdLT3dwUFFFcG9FNjRrSEJzb0JB?oc=5,"November 23, 2025",GitHub Copilot coding agent now uses one premium request per session  The GitHub Blog...
Google News,Which AI model should I use with GitHub Copilot? - The GitHub Blog,https://news.google.com/rss/articles/CBMimAFBVV95cUxQTFY2RmVtNUV2VVRYNzR3U2JZVE5yaVltaUlYdjdndU53YTB2TlZwam5uQUhYR0x4d2FDV09DRy10NldqMklHSzR3LS13cmlzeWc0S2wzanVqbVFhQ0RCVkVwOExhYlJ1WEN6RGEybGd2NzR2anA3QWZQVVg2c1dna0psRHV5MUpCclpPS1cxNHh6dVctbmhPXw?oc=5,"November 23, 2025",Which AI model should I use with GitHub Copilot?  The GitHub Blog...
Google News,How GitHub Models can help open source maintainers focus on what matters - The GitHub Blog,https://news.google.com/rss/articles/CBMiuAFBVV95cUxPYm1hX1FrNndTSXB4aHY5SHJ0UmxpWjZvMXRsWkxzbUM5SThNMHRmYVc5MFUwejZUeTVHRWwwYVVnWFBkWXZCb1VGR0NOV1FuWmZSeTBZc0RWck1WRVE2QUQ5V2ItMVNldUtmSXNSVG5lMVRsN05SWUp0ZUROUnczYnViendVYWdxU014RFgtMjZhM3Y0b1o2d2ROd1VaRGNWX04teXM4UnMwMXB4X1c3T1E2UExSYkJ2?oc=5,"November 23, 2025",How GitHub Models can help open source maintainers focus on what matters  The GitHub Blog...
Google News,Social login with Google is now generally available - The GitHub Blog,https://news.google.com/rss/articles/CBMimAFBVV95cUxNeTBRWlc5UENOM2xSZlA1ZWE2R3EyY1JKT2N0WnhzWEZ4ZldqNlVQZ1Jpb2x4aktqWGpYUklucXJUcG1mUFdIekxQMTB3NW1LcTBGZVd6dzliM1U3S2dac1dCZWhjQnh5UEg1NkZlN21kUzFBWV80bDRiQjRmWVYyWkVkSXlSeC1WYTJwamNjRW5FNGQtejZmWQ?oc=5,"November 23, 2025",Social login with Google is now generally available  The GitHub Blog...
Google News,GitHub Actions policy now supports blocking and SHA pinning actions - The GitHub Blog,https://news.google.com/rss/articles/CBMirgFBVV95cUxOWDdxNjU4N3FKMGFxUTlxQ1FQOUlqSXBVaFIwMV9tVE5DaGZwM0Z3Q2lwT1FNQ05HTGdIV2dHdkNPcWZMSTJITVdqc2F5ZzBtcWF2ZlJKaVp5MzZKM1hRNno0R3d1LTJRZ0xMU3oxZ2t2ZWZodU1QLVdEVWtab002aDhiSlFwc1NnUHpscmZVMW1tTjk1OUNrZ0w3dGZybTRId200b2w0c3k2TTJhVnc?oc=5,"November 23, 2025",GitHub Actions policy now supports blocking and SHA pinning actions  The GitHub Blog...
Google News,Remote GitHub MCP Server is now in public preview - GitHub Changelog - The GitHub Blog,https://news.google.com/rss/articles/CBMiowFBVV95cUxOU1h0ZVpTS244Q0dTN1Rib3ZYUlFoNjFKenZEMDRUNXU3aXNfQUh1RVc2Z24zRjJKRkZMRkI0VFkxRVdDYkJPeUhaZ1REeXJpSzFKdF9SYzlLSllmcFo0am1pcWlkRzNRWi1NOE85SlpMZ0pPX3hGX0ZWZjJ1aGZIVkl3R21UWG1yMU5RVVJkdkdJdzd2VlowWlFKU1hPVGhvR1dB?oc=5,"November 23, 2025",Remote GitHub MCP Server is now in public preview - GitHub Changelog  The GitHub Blog...
Google News,How to Deploy a Hugo Blog to GitHub Pages With Actions - Hackernoon,https://news.google.com/rss/articles/CBMigwFBVV95cUxNRS0zcUtnUkRUM2h1czgwa1RiN3A2cDVnczVhTlp1ZklicjJ6ZWNrR2ZfNGYwX2Fja3hEVmx4UmRaY3EwLVNjeXVlRjZZZTktRGg3TGJJT1RLem9sX1UtOU9Qbkd4cUg5emVtQ2dJVjJXTVVDLU55Wm41SnVHZ3NRNFRPOA?oc=5,"November 23, 2025",How to Deploy a Hugo Blog to GitHub Pages With Actions  Hackernoon...
