Source,Title,Link,Date,Summary
Google News,Evolving GitHub Copilot’s next edit suggestions through custom model training - The GitHub Blog,https://news.google.com/rss/articles/CBMivwFBVV95cUxQT0xSWkNoNkt5a3ZMZzE2S2lRRWRpSjRrSkZvZ0VSakNMcjhEVzZPU0VEb1BPbXlNcTlaTWJnWmRTNll5UW9aYmtuY19VMGxyVXFGWUZYOUk2X1lMY1F2NDhtTzBsQklqZktYZkFNc0NCd21RX052NE1DRUduTTZIM2I0WXVCVVlkQW1SZHZVYklwQUVfYmJXQ05QZDNwTjNwMUo4Z1ZMc29LV21RU1U2T2x5WkFKU1JkQWNjTTlYMA?oc=5,"November 23, 2025",Evolving GitHub Copilot’s next edit suggestions through custom model training  The GitHub Blog...
Google News,Enterprise bring your own key (BYOK) for GitHub Copilot is now in public preview - The GitHub Blog,https://news.google.com/rss/articles/CBMivAFBVV95cUxOcWIxM01mWW5ZdW1xb0xORFhGSkdTNGd3b1pJVDZJWno1bkF5SXJMY1VLTzZLaUZZX05Ca0RFcEpJRGpRcEM0RUk5TDdFOGw2Y0YyUTVYWVhoU3lsbWdfcnJSV3lLU1VSaTVpXy1zaTB3SGNqbGo1Snk1Z1IzM1NaTmdROUVibm8xb1U5ZF9KaWpVSWNaWFZ0N200TVZYU1hyaEN3X3pIOHItblNvaHVPSXE1aVlUMUtFYlNkQw?oc=5,"November 23, 2025",Enterprise bring your own key (BYOK) for GitHub Copilot is now in public preview  The GitHub Blog...
Google News,Linter integration with Copilot code review now in public preview - The GitHub Blog,https://news.google.com/rss/articles/CBMiqwFBVV95cUxOT0NqaV83SDZqR2d1cjlUTGNBOXhQWnU2MkVXb092Mnc5ajNMYjNERWI4MmZMREJKZHMzMDNtaEF3QUZlZXRMQmRsd1pxNXJXd2NSMEpWUFowTGYxUmR0SngyOU5OTEdCZi1FWTdaMjVEcFRpS1NZZU9GZVdSbkpDS1NBREJqbXROOUF0aUtmYTUtNC1tWXFtemNWR3A5Z0ZyNVI1Tnk0NFBzRDQ?oc=5,"November 23, 2025",Linter integration with Copilot code review now in public preview  The GitHub Blog...
Google News,"Quick access to the pull request description now in the ""Files changed"" public preview - The GitHub Blog",https://news.google.com/rss/articles/CBMipgFBVV95cUxPZlJyZURtcmwyXzBnUnRJeWV5TEhzOVJGOXlweDhwWFJSd3RWamNBUlNsbWs5bU05UmZlRy0zeWxnWVY2b09WSDBzdTAwa29qZmF0N2k4b0Rxa1RuR2xhOGk2R1BMT1Z1bFo4ZUdmZ2dRbkpuVkUwU3FNMGdJRmktYzBDTFcyNEc0TWZsZ0VwTG1QMkxsOUQtZnQ0WGd0WWFCd1FHX2l3?oc=5,"November 23, 2025","Quick access to the pull request description now in the ""Files changed"" public preview  The GitHub Blog..."
Google News,AI companies keep publishing private API keys to GitHub - theregister.com,https://news.google.com/rss/articles/CBMiggFBVV95cUxPUWs0d2MzUi1WLWpmUUJESTF3T3BiUTZUT0hVUGNQNEtTWGtjR2oydGJkWFRRSWpKYVI3eVdYdlRtLThGWTZVZ3MzZEl5cmNYbWRIQ0NVaHE5XzJUejY2Rl95VUpsUWdINFJEWUF0SldRWGtTN1RVemZPNVctQldXX2Vn?oc=5,"November 23, 2025",AI companies keep publishing private API keys to GitHub  theregister.com...
Google News,Npm Package Targeting GitHub-Owned Repositories Flagged as Red Team Exercise - The Hacker News,https://news.google.com/rss/articles/CBMie0FVX3lxTFBUTkx1a0FaTVo2TndOOG1RdDR2T051UlF2Mzd4ZmdieUZEbWd5b2lBRy1KeE5vYjNZMnR6N1lBdndFaGN6V29Hb0huSEFWRlNqbFdfU3ZPQmxiMGwtanJNSFo4RzhDaGItV3RwUWU4SGxUSG1fa3Q4aTAzQQ?oc=5,"November 23, 2025",Npm Package Targeting GitHub-Owned Repositories Flagged as Red Team Exercise  The Hacker News...
Google News,GitHub is launching a hub for multiple AI coding agents - The Verge,https://news.google.com/rss/articles/CBMihgFBVV95cUxQY0R2Rl8wOEl3TEw3UUN4YnRiZ3VuY3d0Q3FqeS1kaXRmLVlvT2l6VTdveWRlREZpYkU0dlBFT2ctQUl0emJkYk5vdFlOdDZKRDg1aDdMY3NpQjJHcV9HZVFGaExtdXM3R2dBWlJ4RmdQSl9USTlsX2FwaEZGM0Jsc09qa294UQ?oc=5,"November 23, 2025",GitHub is launching a hub for multiple AI coding agents  The Verge...
Google News,"Apple accidentally leaks new web App Store front-end source code, ends up on GitHub [U: Removed] - 9to5Mac",https://news.google.com/rss/articles/CBMif0FVX3lxTE5nYjg4QlU3X1A5N3pnWVZCNjZKbU9LUlhEdThfQktZNTJ3dXdoRWF4UnVSTjcxU2liUUd5cXhmVXdPZlBiYlNBVE5mZmEwN0hnQW44ZlZQb0VwMmkyVTI0YVcwM0tnMUZQM0llOE4td3RRWTRObW5fbEZ3bVg3RGM?oc=5,"November 23, 2025","Apple accidentally leaks new web App Store front-end source code, ends up on GitHub [U: Removed]  9to5Mac..."
Google News,"GitHub unites OpenAI, Google and Anthropic AI agents in one place to bring 'order to the chaos' - CNBC",https://news.google.com/rss/articles/CBMigwFBVV95cUxOaEM3OVFnVmhFRG9kZkJjREdPeTh5QkdsLXBsODZZS1FrOVl5emlNWHlPSC1lZzN6QVFJbkZmWExrUTdENUdXOUhmVV90WkF5NWU0Y05JT1NMdElramc5TmR3Ukl6czBrcnBiN09FaHB5dkM5OWNYdUZ2bzdNXy1tTHRORdIBiAFBVV95cUxPbWZQbkFIV2hIYUNtcFMwWk9qYzUtbWM0dDNOdkMzNFBtUmdHQTJHUHJnV29uZFhfYTVtM3IxTm5JX3hqeWhYLXcxM1BKRkFMRnd1UE5mMnNXaGJ2MUVLRXpZN21RVzE2MkxPUjZyTHF4UG1SM2RXX2FLcDRodkpFT3BPbXJpTHlU?oc=5,"November 23, 2025","GitHub unites OpenAI, Google and Anthropic AI agents in one place to bring 'order to the chaos'  CNBC..."
Google News,"GitHub's Agent HQ aims to solve enterprises' biggest AI coding problem: Too many agents, no central control - VentureBeat",https://news.google.com/rss/articles/CBMioAFBVV95cUxPOWpnQ0pVSEc4UzFVbU1DXzh6RzYzTU0yZ2xkVkttaVBadDc4UGVCWWlNRGgzbDdOV1hEWWZmQVpKZHpuMnJsZ2hLV1dpUy1pLS0xQllnSl9PbDJfRm45S0pPYzBLRzNSaWVJQ3NpbDVaQ3M0cllISXVjQWJfSG9Xa2J6bXR1T0ZxVGswVU5DbHB0NzM1RV9RTXF3N3lnazYt?oc=5,"November 23, 2025","GitHub's Agent HQ aims to solve enterprises' biggest AI coding problem: Too many agents, no central control  VentureBeat..."
Google News,GitHub - Britannica,https://news.google.com/rss/articles/CBMiV0FVX3lxTE1zT01RZmh3cGtRVHU3Vld2V1VaTk0zdWFzSFZYelJ0SGpiMjJCUjZXRmxQLTdzNy1rQksxMVFka0FmcTRldUhfa2xHNlRuaE54SFgzX0hHTQ?oc=5,"November 23, 2025",GitHub  Britannica...
Google News,Introducing X-Force Malware Threat Research public GitHub repository - IBM,https://news.google.com/rss/articles/CBMipAFBVV95cUxQMjFpRlYxWnkweF9ObmpLX2tZdGxfbTFvOEp3am00RjZpS19YeXZmY25CTmoyX21nT3BUcExETXk5ekFXekpYaXowQkxOYnFDUUpaRURNZTRiLUV5M1J3Z29DbnNkM2JPNjdTRUJpREV2Y1VTeTZ5ZnlmLVV3WmtRRDhoaTZtVzNFbDUybmhkTXBGai0tYWlRbUUzaW5BSXREUGxwQw?oc=5,"November 23, 2025",Introducing X-Force Malware Threat Research public GitHub repository  IBM...
Google News,How we’re making GitHub Copilot smarter with fewer tools - The GitHub Blog,https://news.google.com/rss/articles/CBMiowFBVV95cUxQeGtuWFNTQUo5b0RVRENmUFQya183RGhqYkZVcWV1eUNINVRmSWxoamMzaEVxVnNoYV8yalZSVlJ4SmUtSlR6MmpSbW5OdDZINEU1YVJOOHY5MEpBNElsb0NLaERJZWx0eWJmQ0hUeF82Y1d6amtUY2VjaUd5LTFQRmpDbHZud1VaSDRPZS1KdHhiQVZpaENwckNLd0t0bEdNQkxF?oc=5,"November 23, 2025",How we’re making GitHub Copilot smarter with fewer tools  The GitHub Blog...
Google News,"GitHub is down right now, it's not just you - How-To Geek",https://news.google.com/rss/articles/CBMiakFVX3lxTE9PM2o4anZoN3YwaXpjdWRCdmVucVR3ZmVZUXV4Z2J3NWZrSF85R044WXFMc3h3U3lLLTA2WnFiVGh4YUwzYUhkMGxNdTRZdXQ5dG5EZnZ2N1JzcG83akpCekhKNWFrakhFQVE?oc=5,"November 23, 2025","GitHub is down right now, it's not just you  How-To Geek..."
Google News,"GitHub Copilot CLI: New models, enhanced code search, and better image support - The GitHub Blog",https://news.google.com/rss/articles/CBMiuAFBVV95cUxPTlFjWDBpdldtVHNXYU9KOFZyc1FjNElBQTVhVXRJNnFHQmhOdVNMNHVlTmgxRzNiT3NSTlZvY1ExVTdnZVBIZEttMU5melMtYl85UTFLNmU0aVZHWk9YMGRydFFCR0JYcGc4MWtTRUVtS09OaDJVNlZ0dXNZRjZLcEw2SUVUb1o4T2tRYlMxX2N6NTJrVk9hOFVRRjNOT1U5WjlndXJsQ1UxWjNRampDbVJMZFRRZ3RP?oc=5,"November 23, 2025","GitHub Copilot CLI: New models, enhanced code search, and better image support  The GitHub Blog..."
Google News,"Plan mode in GitHub Copilot now in public preview in JetBrains, Eclipse, and Xcode - The GitHub Blog",https://news.google.com/rss/articles/CBMivwFBVV95cUxOdHBGclE5aEpvNlNFRWxMa2otN2pHa2QwNUd6bElZc2YzWVlNU0t5RDlmcGM0THRySHdBNjBGaER1VWNDU1VsekIyTDV5YTd4WWJudDVBb1NGUGFUSjQzTDRnZXZabUthdXQ2V3NEV3NFU2I2SmpNMUUtd0U5V0RjZTRKT3lubTA5aEx0d2VCcWE4V3RVNkhhd250QmhyTjR3MU5zY2NyUFJ4REtJbjFWY3FPZWlMcmNOVWdJb3VmQQ?oc=5,"November 23, 2025","Plan mode in GitHub Copilot now in public preview in JetBrains, Eclipse, and Xcode  The GitHub Blog..."
Google News,Gemini 3 Pro is in public preview for GitHub Copilot - The GitHub Blog,https://news.google.com/rss/articles/CBMimgFBVV95cUxOelNub0lyN01ub2FiX1FKVEMyYmJETDJiYjNUWnVrR0VSSkVfOTI2LXhHMDh5Ym9ZVWItN1lkS19aRzAyeE5oMkNQMzN1OVdBQnJVdk1xZDZnUmVMNDhUOEpyWUcyX3VJMl90VDNEamVyeVNIOEkwNzh1TlVtdFcyY24yMzNsUmM2cnR1RU5fc2NpYW9ueGNqcER3?oc=5,"November 23, 2025",Gemini 3 Pro is in public preview for GitHub Copilot  The GitHub Blog...
Google News,Highlights from Git 2.52 - The GitHub Blog,https://news.google.com/rss/articles/CBMibkFVX3lxTE1VTDkyNlVGQ3ZzTkR4c2JlUTZCVEo0TFB1MHg1andlTVliWHBTUnpzS1BjT3lSbng2dEpPUmRQU0JlSVhfVmlLRzFPMU10RktLN000ZEF4UmJYU0pGWFFrQVN2WVFLMzJ6ZW1UX0h3?oc=5,"November 23, 2025",Highlights from Git 2.52  The GitHub Blog...
Google News,"How to write a great agents.md: Lessons from over 2,500 repositories - The GitHub Blog",https://news.google.com/rss/articles/CBMisgFBVV95cUxQRWdFbS12R1Z1SE9nM3NxdDd6Z0dlb19SLWwtZ0N0VGRDNFkwRnJsRGYweHlSaHhwVEl6VlFON1pPa0lsb0NhM0YtUm1vTkREV1p1SklobWlYcU1Cc3dfbndnWXAyeTl3cXo0ZW5xd1o2RE10Si1nYXBVQ1VES21scklqMGtrV0QzMk5yMmx6RkJ4Q1hvd18tMnR3dUhJejJaN3dHaE9yMG8xNmdwcTlvLU9R?oc=5,"November 23, 2025","How to write a great agents.md: Lessons from over 2,500 repositories  The GitHub Blog..."
Google News,Level up design-to-code collaboration with GitHub’s open source Annotation Toolkit - The GitHub Blog,https://news.google.com/rss/articles/CBMi0gFBVV95cUxNckctanNHclcxT0dZWHEzTzhUMlgyVWxweXRLc095UlF4TzBLTWhVRk5zUFhxX0V4cUQ1Zm9pQ29fdDNsVHZORWRldEVXWlZxNWEtd0VCckZKOWJLZl95UmotSVJ2OFVzUFJiTFNpdno0bjl2Smg0b0tDcUVTRUdMMzF1MDY2TzFtZkFtZ3JzSHRhWXVUYVFjVXFvSWk0SDdydlBOa2tsUlBSc1U0UkcxRGRORElBYXdWWjdRMWwtRDMyVUZROGl2WUFGWmdHOWlBZ3c?oc=5,"November 23, 2025",Level up design-to-code collaboration with GitHub’s open source Annotation Toolkit  The GitHub Blog...
Google News,GitHub Availability Report: October 2025 - The GitHub Blog,https://news.google.com/rss/articles/CBMikAFBVV95cUxPRHJjUEFjLUFVN0VZZTllTWE0QlRvWU9TNl96akJrZTliTGktTjZkZUN0ZGhNbVBhU0JRejVqeHFPNGpHdW9lcF9lc2x5NjQzdW1USllwam1pWk9RS2FQc2NyRjQxQWlGVTUzZDItdURaMDFMUXE3QmlCRi01SXFOUFRxQ2FBcjc4S19YWmEzMzU?oc=5,"November 23, 2025",GitHub Availability Report: October 2025  The GitHub Blog...
Google News,Copilot code review and coding agent now support agent-specific instructions - The GitHub Blog,https://news.google.com/rss/articles/CBMiugFBVV95cUxQTDc2WWVuNXJqUFNJeDlYZmFJTkdDTUtxd1E3bmFiYUFJUkhZUVlZd1k0YzZrbGJxc2ZKdjBJa0o1QmwxdWYxT1NGdDRrNG1vdXlWWE01MzdEQmxHVzdMZHdnN0ItZGZDYWQweDFmVG8yam5BeTVKZjMxVHJmbGlpOHQ2bHpsTmgwNmN0dHhlSGpDOHB2ZElrYUhjWjVadHU3TVRFTVdXaXhVQ2RGRS0xTzFqM2NuMzRsekE?oc=5,"November 23, 2025",Copilot code review and coding agent now support agent-specific instructions  The GitHub Blog...
Google News,Manage Copilot coding agent tasks in Visual Studio Code - The GitHub Blog,https://news.google.com/rss/articles/CBMingFBVV95cUxPeTh1YmxjMlNFZ2w3LVlSeXp6dUR0STd2V2d2aFNhNllNZGM3NzFTNmJRNW44UG1tUm9sU3BHc21hTEhwYUFJSUVQRDQ1MVFBNWlLaF9QMWVTbmxXbW40b3d5cFFBOUpuR0hobXJrVWVSZXdrNU5FZHdUX2hLeEJ0bHNSeXRQLXFIaWFEMjVzdzhrRmNkWGNzNzJGMkVsUQ?oc=5,"November 23, 2025",Manage Copilot coding agent tasks in Visual Studio Code  The GitHub Blog...
Google News,"Introducing Agent HQ: Any agent, any way you work - The GitHub Blog",https://news.google.com/rss/articles/CBMidkFVX3lxTE16bm1BSU9nTWNOVnF2a2JJUUt3SXVPVTZNZ21OQnhJNnhrbXNrY3FTVVh4RTZuNk5sb3BLWWVCeDM0YUJHQkpwQjNfTmpwRldpSzNONTgydlc0OEhfck5ZREJrNHh4Qnh2MlZ1aTFDbjVvV2NRU2c?oc=5,"November 23, 2025","Introducing Agent HQ: Any agent, any way you work  The GitHub Blog..."
Google News,"OpenAI's GPT-5.1, GPT-5.1-Codex and GPT-5.1-Codex-Mini are now in public preview for GitHub Copilot - The GitHub Blog",https://news.google.com/rss/articles/CBMi1gFBVV95cUxOSW9jTWt3aVBWSGwxellSaXQtYjdzRy1sS0RmNEVBdzJ1TXZvdjNxd0tTMV85ZG5lLW1FSlBEODk0MDYyMkV5TmZId1N0QkV4UE1oZDVBVjE3WkQ4TWNaRS11bjdYWnM3UFFvczJpeTBiR1k1Y1lEZ213ZkpxZzFXWTJjWXcyX3BJTmZUeUkwSktjd3FIM3lrSTVQSm1uNF9FX09yOUszajAxcjZRWnpXU1BHNWJQVFNMQzdCUF9lNUNpT3dfVWdSZ3FBdm54RUFTWDlONjFB?oc=5,"November 23, 2025","OpenAI's GPT-5.1, GPT-5.1-Codex and GPT-5.1-Codex-Mini are now in public preview for GitHub Copilot  The GitHub Blog..."
Google News,Migrating repositories with GitHub-owned blob storage is now generally available - The GitHub Blog,https://news.google.com/rss/articles/CBMivwFBVV95cUxQLTl5Um5mMnd0Q2llUlVqQzBUelhIOWlOc3RZamsxZUFZZ21ydmtpd3FIUzh5Rlc4TUpQMXhheThCaW9uZExvZk01YnpXZUVEN1VXM3pDMTR5dTFmSjl1TW1HNFdVcG53d2JwWExxTV96QVBLaUxyWVBoSFNBMU9PR0NLNnl5YkpnZDdDWU5RMk91alNiWE9KY1JlcjBWVFJNdzgyaWVCWGFkRkR4Q0lzcjRJcEctaXA1elBLdFQydw?oc=5,"November 23, 2025",Migrating repositories with GitHub-owned blob storage is now generally available  The GitHub Blog...
Google News,Octoverse: A new developer joins GitHub every second as AI leads TypeScript to #1 - The GitHub Blog,https://news.google.com/rss/articles/CBMiwgFBVV95cUxQWHdidEFJV2lHZHBfMXN4YTAxclFWX2hZYlY5OFVwei12MWRGX25wQmlTNk1yWDkwUDhQNF92YUJ6NE5jb1dmZXRNNWlBQ0c1UWRpWEhtT3dZSmZ0OTdObjk3NDJia3dhUUwxYzRINlF3aGVDOUxvUUZkT0dKcThXa0hnUkNWM1hBT2xpcW1aSG9WdmRHSGpzTkZDZjJyMUt0Ull0TERSTnVIM29fcHFMNVRLTkZJbXZSUW44UEUyYlNpUQ?oc=5,"November 23, 2025",Octoverse: A new developer joins GitHub every second as AI leads TypeScript to #1  The GitHub Blog...
Google News,GitHub and Microsoft Use AI To Fix Security Debt Crisis - The New Stack,https://news.google.com/rss/articles/CBMihgFBVV95cUxOYzlIQ19EaHRNc25WYktoaS1MUXNDajk1Qm1xOG8zLTdlN1JSaWpyTjVncXA1aTk2MkhHSXU0RGV0eUZVMTBKLTRQUzNCMVNMVVFnck5uQ1ZNamRiTnVPY2QwTDBwX2tDQ1FTT1hRd3QxZ1hDTDN0ZW44YnIzclN3eHBIZDBkQQ?oc=5,"November 23, 2025",GitHub and Microsoft Use AI To Fix Security Debt Crisis  The New Stack...
Google News,Kevin Merchant - The GitHub Blog,https://news.google.com/rss/articles/CBMiU0FVX3lxTE9aVTh2UElWVk1iYXpBUjJrUUJyUUcyQ1FYempUQUdQY1NIaGJPclYxSWJ4ZWNwcXpIRmlycUVGM0lNcE4zaVpRZmM3ZElVWkpINHE4?oc=5,"November 23, 2025",Kevin Merchant  The GitHub Blog...
Google News,"GitHub Copilot tutorial: How to build, test, review, and ship code faster (with real prompts) - The GitHub Blog",https://news.google.com/rss/articles/CBMi1wFBVV95cUxORjhMUUZONGJlUGh0VDM3UGV5YmkzelkxTEdGbTRoc0F4c2dJOGstS0lFRmFQR3Fsc0VXUlRfaWxldWZzc1RtekYxQmVVMFVMX3c2WmZQRnA0M0ptNjdXMEVuT0pDbGJnenVLeFRmOXdDbWJKUjZOTERQaEprR3d5QnloWVhxMThfOVV6YjFlN1Y1ME0wemcxbGdaUV9HamVVZDE0WVBPWUFiUDVNNWc0TlFnbm1UQWZkVzh3bVBWOEFBV2Q4Z2NjTm1Tb2FUQ0JfRUtMNkpTZw?oc=5,"November 23, 2025","GitHub Copilot tutorial: How to build, test, review, and ship code faster (with real prompts)  The GitHub Blog..."
Google News,Developer innovation at the center at GitHub Universe 2025 - Microsoft Azure,https://news.google.com/rss/articles/CBMiqAFBVV95cUxNZW9YMnJzM1pscGY5WUZuVG9LclJjMDNLNVVuU0VJYmQ4ZnBaazVJaXlkbHhIWGhLSUNaXzhZV3F6ZlN6Z3owaTFFd00zaHNRRFRKX1JaOEh4bXBUUEVWaGFDOE9xa2cyMVlPTjh5dVg4cVNQU3Ayb29fMUtRcVM3c3NMZ0hQTUNodjZOamFOLUlGUWEwb0lKU29PNEtBcFVMb0p5SWNJSFk?oc=5,"November 23, 2025",Developer innovation at the center at GitHub Universe 2025  Microsoft Azure...
Google News,AlphaXiv raises $7M in funding to become the GitHub of AI research - SiliconANGLE,https://news.google.com/rss/articles/CBMikwFBVV95cUxOUkp4djQ2N1JuVkxRbnVoakF0WnUyZmpUcUg1LTZNTTkxS1B1QjJlZVBvT2FOOWpfcXY2QUNLOHlabjZKQmtOMHl2YUJXZnhyTjR4MENGODFDbXdQeGZHVnVsLXd3SEZKeEVPdXF2T1gySEU4emJzdlppQVNUTHp4QzFpYzA4bHJZdEpCOHhWNC1GeW8?oc=5,"November 23, 2025",AlphaXiv raises $7M in funding to become the GitHub of AI research  SiliconANGLE...
Google News,"Isolated Subagents for JetBrains, Eclipse, and Xcode now in public preview - The GitHub Blog",https://news.google.com/rss/articles/CBMitAFBVV95cUxQUDJrRXBUZG85MnFFN00xZ2FHbTBtMWl2R1BaNkhvNVRGS3ItSS1oR3g2QkFtWDFyemdXdEg2MmJDSlZyUmgwMm0zRko5TE0waTV5MkpKOEprcF9LcTRVNUg1bmZwYk5YZmRkcHA4VjhhaXo4cUFDTDItcFdUV1FfUlc5QnVfU3NLdUVuSUdTV0czUWJTQTFFS1R2bzZrV2M3YURMQ3dFU0k5UkJ1eVFKem9lY1k?oc=5,"November 23, 2025","Isolated Subagents for JetBrains, Eclipse, and Xcode now in public preview  The GitHub Blog..."
Google News,Yu Hu - The GitHub Blog,https://news.google.com/rss/articles/CBMiT0FVX3lxTE42ejlTdXFkN2lsdEM4eE4wQkZQcjNNYzZoR3BPMTYyZExoU1dvQnhlODRORnVxNGhpMXVvTU5tNGk0eHhfLVhBYVpGdVRIb2M?oc=5,"November 23, 2025",Yu Hu  The GitHub Blog...
Google News,Raptor mini is rolling out in public preview for GitHub Copilot - The GitHub Blog,https://news.google.com/rss/articles/CBMiqAFBVV95cUxNSVBNcWE2VXBoS2w1a2haelJHQk9aazBBM0Z4WTFIdm1CVERSYW5IYWlfX05MRGJIWXBCaTNCODFHZjNoZjVLM1M0bVpfWFVzS1M5NFMzeDN5VVFfRXZFdVg0TUpiN2NKb2JkTjRyUno5d19Zd2NlVkVoUnRoS3VpaFRGR05DbUhaMV9IS3duTGI3QjVoY0ZfbHA3SUpxaFlheHo2VnVHQi0?oc=5,"November 23, 2025",Raptor mini is rolling out in public preview for GitHub Copilot  The GitHub Blog...
Google News,Immutable releases are now generally available - The GitHub Blog,https://news.google.com/rss/articles/CBMikgFBVV95cUxNalNTN2FqbUU2WWV4cGIySDFOYTlvQlNSNl9xcEU1bEhSMEtIUmJxRVk1LU9Sel9HUUdLellIcjEzaU8zM2RQN3Fld1RZVlNnY3NoSVk2S0R2dFh5TVRHZGRVZ0dKWWdwZXBKZVdfWGNzalhoby0yLWFTZlBxVkZlLV9VYmpNX0VCRmxabElBRkZiZw?oc=5,"November 23, 2025",Immutable releases are now generally available  The GitHub Blog...
Google News,GitHub Code Quality in public preview - The GitHub Blog,https://news.google.com/rss/articles/CBMihgFBVV95cUxNSTczN0NXTUlmazFvVU1Na3hUU0lTX0R5Z3FiRTU5NC1aUlVCazdXSGJ4Q1lnSjVabkJ5dThWVWx4SG5SZ1lTMm10Z3hOcTRkR09JWEtHMnN3akJRWnpxdloycnpZeDBQRzJQM0oyVkREREVJWVM1MjZhTkd6RmdOMlhpZDBXZw?oc=5,"November 23, 2025",GitHub Code Quality in public preview  The GitHub Blog...
Google News,"Auf Wiedersehen, GitHub ♥️ - The GitHub Blog",https://news.google.com/rss/articles/CBMib0FVX3lxTFBQWk9leTJwSV9KdG1mRGJRR2F6V1RHeE1xMUpORUVQMDI2bDZkSVhuSUNvaldySEVBSnpJZ041Zmd1X0RmR3hUWm81VGVVTlRmbUtfeW1yeS1tNHloZzk4RG8zeVVWTVFPQWs1d0FsUQ?oc=5,"November 23, 2025","Auf Wiedersehen, GitHub ♥️  The GitHub Blog..."
Google News,GitHub Expands Copilot Ecosystem with AgentHQ - infoq.com,https://news.google.com/rss/articles/CBMiakFVX3lxTFB6bVYyNTVXbzZjU21ldkZCVG1aUHcyVG5GMmlYOVoybEpOUXVkTWxnaFBVUHE3U2pCcUR2ZGFfek9EVEdCczJZcldsTGw0bUo3UVcwejVpeHozZzVMZ2JfN2UwZFp5dTdGekE?oc=5,"November 23, 2025",GitHub Expands Copilot Ecosystem with AgentHQ  infoq.com...
Google News,"CodeQL 2.23.5 adds support for Swift 6.2, new Java queries, and improved analysis accuracy - The GitHub Blog",https://news.google.com/rss/articles/CBMiygFBVV95cUxPQ3RERXR1Um1uMlRVNGJwenFmb0dINzhsbEdpSEdoekY3N3MzMjdWSkZhY25MMml0UE5tUHhGZkZrcVQ3V1F0RkQ2NGRqSVRMUWJSUVpNbVd2dXVoS3k5MTJfS3ZGZERzZDFlTFBHYy1jMFVLaklUQXpDZXRhYV85NHNIeEF4aXdGZ1RmRG8xMlhfNHl4Wi0tNUUxMmFpSFJEaFF6Z2NmaWxXNlhLZkp0VkV4ZzQ5cDlXUnJ5MmJlN2ptRFV1b2UtaENn?oc=5,"November 23, 2025","CodeQL 2.23.5 adds support for Swift 6.2, new Java queries, and improved analysis accuracy  The GitHub Blog..."
Google News,Unified code-to-cloud artifact risk visibility with Microsoft Defender for Cloud now in public preview - The GitHub Blog,https://news.google.com/rss/articles/CBMi3AFBVV95cUxOQzh3dENQMzlONXZwb3BqQXpyZERqVW93VzYxaWJZN0ZMZklHTzY2T0lJYTZaX1lEVjZadVpwaVltTW90d2kzbGE2c2FKcWdFWTVjLTY2Ym9KMElRY0xlZTRZTW1QQ3VyQVBEWkZxZEgyai0wNDRzS2R5U01ZSE5vTGg3c08wajF1X0pZcGUyRGNhN3lWdjhlckstVTdockNlWmx5TEhMU1dFc2tyWUM5dGFZNVhjZnNWcmM4Y0JxcDZJX0EzMUZuMW1WT1Y2NnRDb0puMVMzT1I3WGZu?oc=5,"November 23, 2025",Unified code-to-cloud artifact risk visibility with Microsoft Defender for Cloud now in public preview  The GitHub Blog...
Google News,Our plan for a more secure npm supply chain - The GitHub Blog,https://news.google.com/rss/articles/CBMimwFBVV95cUxPZHNtSDdRekpXNl9LT3FDQUJPWG9PYlN6YjduOHhLaXdJVDZmSy1qTS1QZENSM1JHT3ZSQXpOWWZJUF9YcjA0dnVxa2FQU2hXbTJPTzdPeVY2ck4xeDNFWXRyTGxvbWtDX0VGZFh3M3FxbnhSdEhjbE1EVmZsTFRfLV9sQmpxNkcyVC1LOGpka3dnTUNZakxoLUV5TQ?oc=5,"November 23, 2025",Our plan for a more secure npm supply chain  The GitHub Blog...
Google News,"Claude Sonnet 3.5 deprecated, Claude Haiku 4.5 available in Copilot Free - The GitHub Blog",https://news.google.com/rss/articles/CBMiswFBVV95cUxPU3FGVUZFcjJZZ19tdG5WaWxYVjlIVm5fMUpTNHJtSmtIQzdtY0dpOENQYXlabHlYNFo2R2pPRDJxSXB3U2o0MWhtUDZ0cmVmOUZZX0k4cC1WR1NLSXV0bFVOUFUtVF9Nd1VaRV9oOVR6VWhnWVNEQUpsN1ZJeXA1Vy1qdWVEcVNQUWlSVkdYaXZuZ2lBd3RUbGFUR3ZRM05lQzZEa2pxTm1kak9uUll3SFRSYw?oc=5,"November 23, 2025","Claude Sonnet 3.5 deprecated, Claude Haiku 4.5 available in Copilot Free  The GitHub Blog..."
Google News,GitHub Game Off 2025 theme announcement - The GitHub Blog,https://news.google.com/rss/articles/CBMid0FVX3lxTE5qRVdQcWw0TEFhTnByYXdYU3FUdnlSYm4zZ2YtTUMybjFzdFkyTXVWWjBPNFR4UVp6VmFyZWVBZUhBUUNLSDFQQndkcWpuTWtEQmRKenNNOEltLTIyVDE2Z0JCWmI0S3JsZkw1WWhMd3VkcERweEZJ?oc=5,"November 23, 2025",GitHub Game Off 2025 theme announcement  The GitHub Blog...
Google News,GitHub Copilot in Visual Studio Code gets upgraded - The GitHub Blog,https://news.google.com/rss/articles/CBMilwFBVV95cUxNRjhqMFJLYjU2VExVZU9iRkxoR25Tdkd4Y0lPbjZhU0o1OGVvUlNuc0s3cFZ0LTZzQWh4NW95UnVKUEsxUWg3Ui03TmV2VnpySHppSHQzQkpqT05fWGF1eHdSQ3N1Z3JMR0RuWnp5SDMxTWttN3RsS05sUXZGQ1Y4YzRPTmNxMElLbEEzX1BqbDY2Ri1PMTc0?oc=5,"November 23, 2025",GitHub Copilot in Visual Studio Code gets upgraded  The GitHub Blog...
Google News,GitHub Spark in public preview for Copilot Pro+ subscribers - The GitHub Blog,https://news.google.com/rss/articles/CBMiogFBVV95cUxQNGg0WTdwd0s1MEUxRDRmbThoZmd2Ty1oSGlST0VyaEYyRy1VcW9TYk9pekRoa284eHJuSGlDWVh3UFB6dTlIQlRqSlpqUnRERWtTYzZXMWFScEYtU3ZnU1prWnliOXROcEU5bU5iSGZoSW53X1B0MmZLRHBkd19MaUxYRWpXWllUUFlIZVo1REhKbXBZUkV4dEJGbS1MM2NXZVE?oc=5,"November 23, 2025",GitHub Spark in public preview for Copilot Pro+ subscribers  The GitHub Blog...
Google News,GitHub Copilot: Meet the new coding agent - The GitHub Blog,https://news.google.com/rss/articles/CBMikgFBVV95cUxNQ1N6ajZwLVdZYmRDZjQ1THBNZThKVENhZ01zSldZQU0yekNIRjdESFR3VTc5UTFFMXZ3WnZBcXZBbGxTTnlpaHdMUGxvTDBUNFh0YmFzMXE4X0tBclFuUHl5c0NNMkwxcUNOVE1PTElNWGpDckc1LVprRmZwamduNHZpUzlWQ2d5bjd1aVBJeHFNUQ?oc=5,"November 23, 2025",GitHub Copilot: Meet the new coding agent  The GitHub Blog...
Google News,Using GitHub Copilot to accelerate PowerShell scripting - TechTarget,https://news.google.com/rss/articles/CBMiqgFBVV95cUxOX2hkZFpUT0pyNTlqeFh3VmFYQ212cjBxVTJ2c1JCZ1czcGZpRWd5X2tDckJEeEpOR0x2WWlueG1fX0lFVXY1YzV0TnpCYUJna0R1bWdVQWMybDU0c2VzUnNDMFFLZmlybUZMMW51Rnc5UThEUlFWdTBrLWJwSWhSNHRXU3I0bEJuVnNVYlNrd1o3TWxqWGRnb0d1aDB1RWZjOG5GMk9NbkdDUQ?oc=5,"November 23, 2025",Using GitHub Copilot to accelerate PowerShell scripting  TechTarget...
Google News,"Auto model selection for Copilot in JetBrains IDEs, Xcode, and Eclipse in public preview - The GitHub Blog",https://news.google.com/rss/articles/CBMixwFBVV95cUxPN3hHbjFuWWlpTHhKWUJqQzBtVVJNRjUta2N4bE9RcXJEOVBHTHllb0JkcVl4a1NiY1RkUTg1dlZmWFotOEgzM0tKeldOS0c5R0c2VEhONGRnNmNxZUpYbE5iNGVmcE45akNHUHZEbFdEdjJUc1VwbzhfeVZ5ZHdPRzY2Ni1VVlU5Q2VEZGQ0d2c0ZkZ0RWJZMURNR0RsZXl2NW9CbndYVTRiZ3lRbWtBR2ZsWDRrTzlwNW54anlsaG04OVlvZzA0?oc=5,"November 23, 2025","Auto model selection for Copilot in JetBrains IDEs, Xcode, and Eclipse in public preview  The GitHub Blog..."
Google News,Anthropic Claude Sonnet 4.5 is in public preview for GitHub Copilot - The GitHub Blog,https://news.google.com/rss/articles/CBMirgFBVV95cUxNTlpuSmh1dVpMN1A1RkVsSGZ3bWJDUU8wdW5JSWVmaWYwVDF0dy1YLVFySnNuMV9kQjNaWXBJc3FUN0hxSlpPWnNld2hWNUR1aFMzamp5MFpralZpQ3gyWk1lQ3BjVGR1emJBb0VBRk13bHRvNnN0bW9Ub2xDS0tWek9mSlR5cGlyVlZ3RTBMWUNadFFOUXVtc1NiZVdiZklWOVZTdzkzcHV1SHJjM2c?oc=5,"November 23, 2025",Anthropic Claude Sonnet 4.5 is in public preview for GitHub Copilot  The GitHub Blog...
Google News,OpenAI GPT-5 is now in public preview for GitHub Copilot - The GitHub Blog,https://news.google.com/rss/articles/CBMinwFBVV95cUxPS2JReU1mdENMSFV1Rnd1ZGNfQXc0bVNFc05mTjViUk1YYl84aWFZX0t2Q1ZyVGxRQ0c5MlNjTDBmWkNQZnN3a2FjWHVPZnVmQ2ZRLUNMTncwbEJHQXNUQzBweF9ZYzRlaEFFbTB1N014bW9IdkhIVUpwdmx1LUNidzhfeVJURERjMFRid0F2cXl0OXNQUnFfWnNTSXE0RUU?oc=5,"November 23, 2025",OpenAI GPT-5 is now in public preview for GitHub Copilot  The GitHub Blog...
Google News,GitHub COO says: Our vision is that a student starting with GitHub in college today could be ... - Times of India,https://news.google.com/rss/articles/CBMihgJBVV95cUxNbHNwNGJjRDBhUzJpanYzZGJLN1JoTDh6VGNQc1dWMlFWNkZNWTE4MHpWeHhNRzZzaXZCQ0ZfVUJWRUZjNl9Iek9UN2dtY3N0YThFeFliQmJYSXlqallNaFRqbC1SVnZVVF82NWxNZDE2TjBKZmVYaXpfaWUyLVpnQ3BhNzloQV9uVXNSalpnbm54c1pyclVua1dwOFlvcWR4aTVqVTFuVTJzMU1LT3pEZ3Z2T19DYUt2aGtUNGZISmtMUDg0aVo3bHMtdE1Zdi1aSnltS25PRHlKaGZicGVXRjhLOTBZS3VoQ29YZTJvcUhWbDg4R2xiTXFJVi1VN1h6ZFFHd1l30gGLAkFVX3lxTE1idVR0R1ZMZUcwdGNseGhTb3VTcFc1YjFnSFktVl93UWF0OVNyLW1RZmNoRUt3SjBxUThrdkpLVUYxelowUWRuZjlrS1Z0dW9Kb01mUU9RZzdTcnZHcWw2aEN0RjBCcUJPS09uRkxXQzF4b1NKWTlieHNZTm94Q3E4enZjZ3ZiTW4zUXgzU1hiU0tud0Y2LXdFUUhqSEdob1hEZERjOVJiSlVGWmk0LVJkU2sxcFJLbnJGcENBTk05Y09tdXhrUVZfU1d4U1FUNlE2YU9HMVJNX29mbndNNmNZVWU3ZXVZVnBXYTNxUU9YeTNfZHV5aVlaOUc5T0t1ZGxHdVBaT1l6dDBuWQ?oc=5,"November 23, 2025",GitHub COO says: Our vision is that a student starting with GitHub in college today could be ...  Times of India...
Google News,"The GhostAction Campaign: 3,325 Secrets Stolen Through Compromised GitHub Workflows - GitGuardian Blog",https://news.google.com/rss/articles/CBMie0FVX3lxTE43a2gzSFlacHpuNzJJZDBOZVNCNjVJM19MQzEzUGVLWG5mbTVRX2RGYkM2NmVEUzh2RW5EeVliWksyWEZ4QXVKay13VDhQRC11a1pSV2YxM1I1dm5Ja24tb0M2WVlBR25fVjBWOTJBc19SQ1JoV1dUbVZFNA?oc=5,"November 23, 2025","The GhostAction Campaign: 3,325 Secrets Stolen Through Compromised GitHub Workflows  GitGuardian Blog..."
Google News,Gemini 3 is available for enterprise - Google Cloud,https://news.google.com/rss/articles/CBMimwFBVV95cUxPMjl3Q09zMVAyYW5XUk8yTlI4RE4tYmFvUURpUDNxd3Z3Q2RQa0RjZVVwV3c3eEZGS3YtSXBZOUtIZ0ZlMWpRSjhjd2wxcUZJbFExNEdVVDlRVGFRejhWcmI3Ym1OSlVpMERUdnZFMk42em5ERlllNld3VUZqTnJTMjFkY0ZJU1ppV2FqN0tiQUJweUdMTTE2cURGOA?oc=5,"November 23, 2025",Gemini 3 is available for enterprise  Google Cloud...
Google News,Build and deploy a single-page application in Power Pages using GitHub Spark and Codespaces - Microsoft,https://news.google.com/rss/articles/CBMi7AFBVV95cUxPT05BX3FBWm1pUEcyUTRTejJISDBVRFlrNjdtb01GWDdLcjVjdHU1d19Xay0ybTE1STI4cTdMZkwzUnhWX0xHTUNzLVpJZjh0TUVJdXM2bWtzYzR3bEpQODRKOHFnMHdjMnFlZmJmcGY3REVIUkZGd1d2NVU3bFppVExKanpUd1JoWlZUYnZwOWI2WnZqd09KaWx5MzhxaHZQLXpCcFMzYm40NW5PRG5IOUdkOERlQ0VmQVo5WjJSTzJFZmNSbEtjOHBsM0ZXMEwwX2E1a3RPeUkyVzZmdTRkeVNLYWNHVW9FRnpzbQ?oc=5,"November 23, 2025",Build and deploy a single-page application in Power Pages using GitHub Spark and Codespaces  Microsoft...
